{
  "decision_audit_trail": [
    {
      "condition_evaluated": "all_sources_have_comparable_licenses(with=['pypi_json', 'deps_dev'], without=['clearlydefined'])",
      "outcome": "INCOMPARABLE_FIELDS",
      "rationale": "One source provides license fields (['pypi_json', 'deps_dev']) while another lacks comparable fields (['clearlydefined']). Lacking comparable fields, consistency cannot be determined.",
      "rule_id": "CONSISTENCY_01_COMPARABLE_FIELDS"
    }
  ],
  "ecosystem": "pypi",
  "evaluation_timestamp": "2026-10-13T12:42:42Z",
  "name": "hatch-vcs",
  "normalized_evidence": {
    "clearlydefined": {
      "available": true,
      "declared_license": null,
      "derived_from": null,
      "discovered_licenses": [],
      "endpoint": "https://api.clearlydefined.io/definitions/pypi/pypi/-/hatch-vcs/0.4.0",
      "role": "supplemental_license_analyzer",
      "source_id": "clearlydefined",
      "status": 200
    },
    "deps_dev": {
      "available": true,
      "derived_from": "pypi_json",
      "endpoint": "https://api.deps.dev/v3/systems/pypi/packages/hatch-vcs/versions/0.4.0",
      "licenses": [
        "MIT"
      ],
      "published_at": "2023-11-06T06:24:55Z",
      "repository": "https://github.com/sponsors/ofek",
      "role": "derived_indexer",
      "source_id": "deps_dev",
      "status": 200,
      "subsequent_observation": null
    },
    "registry": {
      "artifacts": [
        {
          "artifact_id": "hatch_vcs-0.4.0-py3-none-any.whl",
          "artifact_type": "bdist_wheel",
          "digests": {
            "blake2b_256": "820f6cbd9976160bc334add63bc2e7a58b1433a31b34b7cda6c5de6dd983d9a7",
            "md5": "82bee9889b95170e550c98f8dd11bc61",
            "sha256": "b8a2b6bee54cf6f9fc93762db73890017ae59c9081d1038a41f16235ceaf8b2c"
          },
          "files": null,
          "origin_url": null,
          "release_record": "pkg:pypi/hatch-vcs@0.4.0",
          "upload_time": "2023-11-06T06:24:55.389793Z",
          "url": "https://files.pythonhosted.org/packages/82/0f/6cbd9976160bc334add63bc2e7a58b1433a31b34b7cda6c5de6dd983d9a7/hatch_vcs-0.4.0-py3-none-any.whl"
        },
        {
          "artifact_id": "hatch_vcs-0.4.0.tar.gz",
          "artifact_type": "sdist",
          "digests": {
            "blake2b_256": "f5c954bb4fa27b4e4a014ef3bb17710cdf692b3aa2cbc7953da885f1bf7e06ea",
            "md5": "d801fe7c3e5955307748f2790bbb3488",
            "sha256": "093810748fe01db0d451fabcf2c1ac2688caefd232d4ede967090b1c1b07d9f7"
          },
          "files": null,
          "origin_url": null,
          "release_record": "pkg:pypi/hatch-vcs@0.4.0",
          "upload_time": "2023-11-06T06:24:57.228892Z",
          "url": "https://files.pythonhosted.org/packages/f5/c9/54bb4fa27b4e4a014ef3bb17710cdf692b3aa2cbc7953da885f1bf7e06ea/hatch_vcs-0.4.0.tar.gz"
        }
      ],
      "available": true,
      "derived_from": null,
      "endpoint": "https://pypi.org/pypi/hatch-vcs/0.4.0/json",
      "license_classifiers": [],
      "license_text_evidence": null,
      "licenses": [
        "MIT"
      ],
      "published_at": "2023-11-06T06:24:55.389793Z",
      "repository": "https://github.com/ofek/hatch-vcs",
      "role": "upstream_registry",
      "source_id": "pypi_json",
      "status": 200
    }
  },
  "provenance_and_dependencies": {
    "dependency_relations": [
      {
        "independent_truth_valid": false,
        "nature": "Downstream ingestion of upstream registry metadata; consistency represents ingestion propagation, NOT independent ground-truth verification.",
        "subject": "deps_dev",
        "upstream": "pypi_json"
      }
    ],
    "sources_consulted": [
      {
        "derived_from": null,
        "endpoint": "https://api.clearlydefined.io/definitions/pypi/pypi/-/hatch-vcs/0.4.0",
        "fetch_timestamp": "2026-10-13T12:42:38Z",
        "role": "supplemental_license_analyzer",
        "source_id": "clearlydefined",
        "status": 200
      },
      {
        "derived_from": "pypi_json",
        "endpoint": "https://api.deps.dev/v3/systems/pypi/packages/hatch-vcs/versions/0.4.0",
        "fetch_timestamp": "2026-10-13T12:42:38Z",
        "role": "derived_indexer",
        "source_id": "deps_dev",
        "status": 200
      },
      {
        "derived_from": null,
        "endpoint": "https://pypi.org/pypi/hatch-vcs/0.4.0/json",
        "fetch_timestamp": "2026-10-13T12:42:38Z",
        "role": "upstream_registry",
        "source_id": "pypi_json",
        "status": 200
      }
    ]
  },
  "purl": "pkg:pypi/hatch-vcs@0.4.0",
  "ruleset_version": "v0.1",
  "synthetic": false,
  "verdict": {
    "avoided_false_positive": "Avoided false-positive 'CONSISTENT' verdict when one source lacks comparable fields to verify against.",
    "category": "INDETERMINATE",
    "confidence": 0.0,
    "details": "Source(s) ['pypi_json', 'deps_dev'] provide license declarations, but source(s) ['clearlydefined'] lack comparable license metadata. Enforcing hard constraint: missing comparable fields strictly outputs 'undecidable', NEVER defaults to CONSISTENT.",
    "subcode": "undecidable",
    "summary": "Cannot determine consistency due to missing comparable license fields across sources"
  },
  "version": "0.4.0"
}